600	1	Daer People of the Newspaper I think that computers are good in some was like to look some think up adout the other side of the world. Like if you have to do a paper on the other side of the world a computer is up to date unlike a book so computer have a good effect on school kids and work so computer are good but other then that most people send all day talking to people on theme and don't go out side and get fresh air so computer have bad effects on some people and have good effects they all need for work and stoff so I think that most people use computer to much to talk to people and for gaming. But some people don't go on it for a long time and go out side and use a computer if they have to for work so the effects of computers is that to meny people use theme forever and talk to people and site and get fat from not going out side and playing and geting fresh aire so most people over use there computer on facebook and stof like that were they code go out side and site on a swing and txt and get fresh aire.	3	3		6																					
610	1	"Dear @CAPS1 times, @CAPS2 people think that computers are good for socity but I do not. Computer's riskes out weighs the benighits. My first example is my father. My father never turned on a computer in his life and his buisness is doing fine. My father and his father has all of their records in a safe. One of my fathers friends had everything on his computer. When a virus hit it all of his files were gone and along with his records. My father handwrites all of his papers. He says if i need to type something out i'll buy a type writer. Also on things like facebook someone can see everything that another is doing. This is were alot of people pose as someone eles and thus @CAPS2 people get kidnapped or killed. A very good reason is that when people have alot of personal information when a virus hitls that person knows everything about you that you put on. For exampel i was watching a show on discovery channel when a man hacked into a myspace acount and used that persons name to people and try to create a cyder to the pentagon, that person almost got caught but never was. So you can see why my family does not like computers. My family is always at the farm or in the barn working on we have no time to be on the internet the only thing you need it for is school work. What ever happened to the old fasion way no computer, no problems."	3	4		7																					
611	1	"Dear @CAPS1 @CAPS2, I have @NUM1 reasons why computers effects have on people. First, computers are not good for your eyes. Second, the reason why people get on computers a lot. Third, there are so much games and places to go like myspace, facebook and even twitter and much more. Keep on reading so I could tell you all about my three reasons. First of all, computers are not good for your eyes because computers are like @CAPS3's is the something but not really because computer as more information and @CAPS3 dont really got so much information you could browse for. My second reason is that the more people be on computers the more blind they could get just for being on the computers for a hour or more. Third, some people dont even dare if they be on ocmputer they wont they might think that just becaus ethey wear gasses they wont get blinder but they are wrong they will get more blinder. As you reading you will find out my second reason fro being to much in the computer. My second reason, is that why people get in computers alot well peopel get on computers just to their or do their taxes but that is not good because just because your doing your bills or your taxes you  to alot of information that people in other countries or state could get without you knowing , second is that people or get on computers to pay their bills or do their taxes they also get on the computer to maybe order something or buy a ticket to fly to a place they want to go like a vacation place or a business trip. my third reason is that they not only buy or order things but thet get in websites that will make their lives better like meeting soembody special or something else. As you keep reading you will find out my third reason for being to much and so long in the computers. My third reason, is that their are alot of activities to do in the computer for a example myspace, facebook and twitter are the most popular website that people get in just to meet new people and talk to old friends. In conclusion, people should not be on computer too much because of their health and their privacy and also to be sure not to meet strange people. "	4	5		9																					
615	1	"Computers should be for everyone! Dont you think?, I do. And here's how @CAPS1 gonna convince you. Computers can basically be called a gateway to learning. Positive effects that computers have on peole is that, it teaches hand-eye coordination, give people the ability to learn about faraway places, and even allow people to talk online with other people. These great qualities computers have for people are fantastic. Also the fact that computers just keep upgrading as time goes by. So, by you reading this introduction, I hope you are satisfied with what I am going to in order to show you that computers are positive devices and can be helpful to everyone. Firstly, as I started in my introduction paragraph, computers help teach people hand-eye coordinates. This i believe is a good thing to know because without it, there arent many things you could do. For example fly a plane. You wouldn't be able to do that without both hand and eye coordinates because you would have to manually move the plane, and check to see if everythings in order by multi-tasking. Furthermore, this is just one given reason on why computers are positive towards everyone's benefit. Secondly, computers give people the ability tolearn about faraway places and people. This is also good for people's benefits because, theres knowledge in every bit of it. Your learning about others cultures, heritage, family history, and so forth and so on. This could also help you in the long run with any job you want to do because knowledge can get you anywere. It can get you very far in life so learn as much as you can, and I beleive computers can do so. This is another reason why computers can be positive. As for the last reason, I say that peolple can also talk to other people online on the computer.This is also beneficial because again, like I stated in my @NUM1 paragraph, you can learn many things that way and meet new people. Now dont you think computers can benefit anyone! I do and will always have the same opinion that is positive towards computers. For my conclusion, I would like to say that I hoped you enjoyed every bit of what I had to say, and you can also agree with the positive affects computers have on people. I truly beleive that computers are beneficial to all people and should continue to be around. it benefits society, and I enjoy every bit of using it. Thank you."	4	5		9																					
616	1	"Dear Newspaper, People always believe that technology today such as computers are making more and more people lazy and not going out into the real world such as people who don't spend time with family, become very unfit, and also @CAPS1 websites and people you talk to can put you in harms way and you can get hurt. First, who wouldn't want to spend time with family and find out things that happend to them, @CAPS1 people because they are to busy being on the computer instead of going camping with the family, going to an amusement park and also some family gatherings. People who thinks that the computers is a helping thing to use but @PERSON1 said ""@CAPS1 people learn much easier from family of friends then from a computer. Second, @CAPS1 people are becoming @CAPS2 because of computers intead of going for a walk or nice day they sit in their room and sit on the computer and seeing virtual things instead of seeing things. @CAPS1 prove who are sitting on the computer people you might should be joining a sports learns with everyday. Last, @CAPS1 @CAPS3 that go on the computer and adults are getting because of the of talking to people you have never seen or really know about. When you are on and someone and live where you live they can be lieing and you could take them seriously and meet up with them and that is how you can get killed or go missing. Also, the computer allows you to put pictures and videos online and a lot of teens and adults are posting up on the internet very inapropriate pictures of these bodies and people should't be seeing that. I hope that if you or a family is always on the computer you should say you need to spend time with your family, you can become very unfit, and you can be at risk of getting hurt by people you don't know."	4	4		8																					
623	1	"The people who are concerned about the bad on computers are right about a couple things, but good does come out of it like what is the miltary needs recruits for the army they can post up their ad on the computers that everyone will see, and what the people who drop out of school and they want a second chance they can appily for scholl online. My last reason is what those people who have a hard finding work they always look up the best job for them over the internet. Read More to find out how the internet is good for society. First, as the army keeps losing more and more soldiers in combat and they try to recruit people they can post their ad up over the internet. Sure they can mail it out but that would take forever for people to find out about it and learn about it. For example, they can post the ad up on myspace and have thousands of people looking at it in minutes. Finally, the internet is a great way for the miltary to recuit soldiers. Next,"	3	3		6																					
625	1	"Wouldn't you agree that spending time on the computer takes away half of your life? Going on the computer can have a negative effect on you! Personally I think not going on the computer benefits you, @CAPS1's more time for your family, going outside, and staying healthy! Certainly going on the computer will mean less time for exercising. For example, lets say you went on the computer for an hour, that hour could have been used to go outside and stay fit! think about the choices here; you could either sit on a chair and play on the computer or take a nice run and burn a ton of calleries! Statistics show that @PERCENT1 of people that go on the computer instead of getting exercise, are in risk for health problems including obesity. As you can cleary see going on the computer really isnt the healthyiest choice to go. Most definatly going on a walk or enjoying nature is better than going on a computer. A girl named @PERSON1, from @LOCATION1 ""I love to enjoy the beuty of the outdoors that god gave to me I wish I knew that years ago while I was a lazy woman on the. If you just even look out your window to see this beautiful god created for us you would want to go out there and enjoy @CAPS1! Everyone wants to live like there dying or in other words live life to the fullest! in order to do that you have to see life and go out there and experance @CAPS1, not sit on a computer! Without a doubt this world is gorgeous and @CAPS1 is worth while to see the nature! Everyone knows that family comes before everything! For example, you might love the computer but that love should not over power your time you spent with your family! One day on a @DATE1 night @PERSON2 was on the computer and her mother called saying, ""@PERSON2 @CAPS1's time for dinner"", @PERSON2 ignored her mom and chose to go on the computer! Now you really cannot give up time with your friends and family since they are so important! I know with my heart and saw that my family means the world to me and everyone shown more time for each family member, not the computer! Its now or never to decide if computers benefit society or not! With no computers you could have so much free time for your friends and family if you could only imagine! Most importantly @CAPS1 will not only benefit you but @CAPS1 will mean a lot to your family so what are you waiting for? Get off the computer and spend some qulity time with your family!"	5	6		11																					
626	1	"Does computers have an effect on people? Do they have a good effect or bad effect. Dear Local Newspaper, I agree they have a good effect on people because you can learn from them, you can can look at maps if your leaving out the state there good to talk to people online, you can shop online. I don'@CAPS1 think adults spend too much time on computers than exercising I think kids mostly on the computer playing games and other activities, some people use computers for homework, writing papers, or searching for people. Computers are good ways to learn about people and words, there not just for playing games and listening to music, there for good use, you can look up restaurants and look at there prices, @LOCATION1 shows site you can look at episodes of @CAPS1.V. shows online. I think computers are better than books and dictionary because you can do all that stuff on a computer. Some people think computers are good things to have cause its fast and easy. Some people thnk computers are a waste of time on them. Computers are good because if you need to write a paper you can type it and print it instead of having messy hand writing, computers are good for if your in a rush to search something its fast. Computers are useful for anything like books, writing paper, websites, chatting with friends web maps, music, games and etc, they do have a good effect on people and kids. "	3	4		7																					
628	1	"Dear @LOCATION1, @CAPS1 you imagine where the world would be without computers? Our daily lives would be dull and boring without new technology. Computers help society do various activities that would be impossible if we didn't have computers. They give us the ability to learn at home, connect with other people, and give a source of entertainment. From these reasons our lives because easy and convenient, which is what @CAPS2 people strive to accomplish. The ability for an average person to learn has greatly increased. It has gone from just being able to go to school to the @CAPS2 various ways to increase your intelligence on the computer. Programs such as @ORGANIZATION1, which teaches people how to speak a language, are available on the computer. These programs are like going to school, but more accesible to the public. To further help the public, there are ways to gain college degrees online. that how . Even if you go to school a computer @CAPS1 still help you excel in you work @CAPS2 sources of research are available on the computer and you like to the web a computer is a great place for fun. However, people still think computers are good. They claim to gaining on the other hand, the computer gives people website to help lose weight.They also say people aren't enjoying nature, even though there are @CAPS2 ways to appreciate on the computer. Lastly, it is stated that you dont . To conclude, computers greatly benefit us and are good. New technology is good thing and should keep expanding because of gaining the ability to , conncet with people and having fun, a computer helps the general public. Please, think of what i have said and buy a computer!"	6	5		11																					
632	1	"People using computers is a good way for them to talk with distant relatives or friends, learn keyboarding skills, and research about far-away places. First, the wonder ful technology that computers have is amazing. They can surf the web in milli-seconds. This benefits people because if you were doing a research paper on china, many search engines let you surf the web at blazing fast speed, and in a little time, you could have all the information you needed. Scientists say that @PERCENT1 of computer-users have fast internet, and they reccommend it to other, first-time buyers. The computer that I use is a unique computer that was customizable to my liking. I like playing games and editing videos, so I got an outstanding graphics car that has outstanding speeds for rendering videos. This let me play games and edit videos, and my @NUM1 gb hard drive is capable of storing all my programs and projects, for future use. Doing many things on the computer can really help your hand-eye coordination. In fact, about @PERCENT2 of computer say that over a using a computer. they were to type @PERCENT3 quicker that they could before. Thats a very good number, but the average person woh types could write in @NUM2 in I have. I can type a that big in about @NUM3 minutes because it have been typing in other @NUM3. Computers are a big part of my life and I still have time to do other things with my family, and friends. The last thing that computers help us people with chatting with friends on websites, like facebook, myspace, and @ORGANIZATION1. They all let you share with all of your friends, and of you needed to, you could chat with far away friends or relatives. This helps because if you haven't talked to your cousin in a while, you can check up with him and talk about things. I have a causing who graduated college and is now teaching in @LOCATION1, and when our gets together, we webchat with him on @ORGANIZATION1 and it is helpful because we haven't seen him in @NUM5 years, and we all wanted to see what he was up to. He was also able to send us pictures, which helped because we all missed his face. So, blazing fast speed to chatting with distant relatives. These are key factors that show us that you can have fun on computers and still have time for family and friends."	5	5		10																					
635	1	"Dear @CAPS1, @CAPS2 of late there has been controversy of how Computers affect people's lives. I believe that the effects on people negative. My main reasons of this argument are. The persons health their the users well being. Did you know that over @PERCENT1 of kids and teens are obese @NUM1 computers can contribute to this statistic. If a person is eating unhealthy but sizing. They can still be fit but if they go on the computer instead of working off all the. They become fat. This can be a serious problem. Becoming overweight has many health risks liked heart other. It also could prevent a person from excersicing. If they are overweight their legs could ache and a simple set of stairs could become a huge challenge. Do you want in obesity rates? I would think not. If you watch tv you could picture perfect families. We all know that no family is like that. Introducing computers could mess up that fact even more. For example, my cousin used to be an outgoing friend person. Now because of computers he is a @LOCATION1 who does nothing else but play on the computer. He gets up eats breakfast. (The of about ), then plays on the computer untill lunch. He eats a small lunch and right back to playing. After along @NUM2 to @NUM3 more hows of playing. He off the computer, hopps into goes on his laptop all night. This greatly affects his family. They try to get him off but all he does is online. He cant interact with his family and this has a huge infact on it. Even though he could get off and talk one of the only ways of talking to him are through facebook. Now because of this family is. We can easily avoid this by telling every body these known facts. My final argument for you is the users well being teen many of us have a facebook of @CAPS3 I have homework I to use the internet for facts and stories. @CAPS3 I do so to go on facebook. If anyone dows the effect our grades. If we chat on facebook we doing our. If arent doing our homework we wont get a good grade. If we could less to other serious problems. Another thing is that you could actually need your computer to stay. It could be addicting and you might rely on it ""once a to kill himself because he dident have his computer"". So @CAPS2 you can see there many negative effects on a user of a computer. It could many problems inthe future like health. the family happiness. So spread the word for the sake of thousands of people."	5	5		10																					
643	1	"Today more than @PERCENT1 of our population spends expensive amounts of time each day on the computer. I agree that having a computer in your home is benficial at time, but to me the disadvantages outway the advantages of spending to much time on a computer. Disadvantages such as cyber bullying, illegal websites, the criminals that use the internet to target days, and the interference that spending to much time on the computer has with your grades and other school work. I think that largest number of people affected by spending to much time on the computer are kids. Mostly kids right name from school, drop there backpack, and instead of sitting at the kitchen table or study area to do homework, they sit right down in front of the computer. Then what happens to that homework? It usually doesnt get done. That absence of homework could make an enourmous decline on a students average. However, homework is not the only school work effected by the computer. Even in school kids use internet on their cell phones. This provides a huge distraction for kids and usually ends up with the result of kids not completing the task asigned to them. Not getting work done is not the problem. Computer presents to kids through. It also helps with bullying; cyber bullying. Alot of kids are bullied and picked on the school but then that bullying carries itself to the childs home threw the computer. Once at home a kid can get hurtful emails or instant messages. These hurtful messages @MONTH1 do a lot more than just hurt someone feelings, it can hurt their self asteem and how they feel about themselves. Then as if cyber bullying and not doing homework werent bad enough. there are also criminals on the computer. These criminals prey on kids. They can find passwords to accounts. They can find out personal information about yoo because of how much time on the computer each day. Once they find out enough about you they use to it gain your trust and the problem only escalades from there. Although many kids are affected by the amount of time they spend on the computer each day, there not the only ones. Adults are affected just as much and just as easily. One thing that lvers adults in to spending all their time on the computer is all the ""great deals"" they can find on the computer. But many of these great deals come from fake or illegal websites. Websites that are selling stolen merchandise. Then show you all the benefits from buying from them and then once you believe them and buy what they are selling, they have all of your personal information. From their you can end up with an empty bank account or even identity theft. Does that realy sound a ""great deal?"" @CAPS1 to me the disadvantages of having a computer definetly out way the advantages of having a computer. I think that people need to step away from the computer desk, get good grades, avoid bullying and criminals. Keep there bank acounts full and there identity safe. Instead they should spend time outdoors, with family: or enjoying life!"	5	5		10																					
652	1	"Dear Local newspaper, I agree that computers have an effect on people. It helps people learn hand-eye coordination, give people the ability to learn a far places and you can talk online with other people. Computers teach hand-eye coordination. As @CAPS1 grow up, they learn about letters of the alphabet and spelling. There are many online programs that teach @CAPS1 how to type. Once the @CAPS1 get in learning how to type, they end up typing fast. Computers help @CAPS1 of future learn & with all these learning websites, @CAPS1 will be able ti teach them solves new things. Isn't it a blessing to be able to meet people from a far? You'll get ot learn there cultures. Would you want to know something about? They make daily go around, there you'll you? Well its so learning a new culture is a faster way of making friends. Have you connect. Oneday i will people who dont just want to be friends, maybe more than that. Be positive about online chatting, or online dating services. As you can see for my reasons above, the computer has an effect on people. The computer teaches you hand-eye coordination, it also gives you the ability to learn afar places & people, and it allows you to chat with other online people. Make sure you stay positive & be safe on the computers."	5	4		9																					
