312	1	"Dear, @LOCATION1 @CAPS1 I think the use of computers are good, here are some reasons why? My first reason is you can find stuff online. My second reason is you can have fun. My last reason is you can make @LOCATION1 friends. I will write @NUM1 paragrahs explaining my reasons. Going back to my introduction my first reason was you can find stuff online. If you can't find a job you can go online and find some. If you want to go to college but you have no time you can take classes online. Those are my details to support my reason. My second reason was the computers are so fun. To me they are fun because when you are bored you can play games. If you are not a game person you can play servays. Or you can find out facts. That how I can back up my second reason. My third reason was you can meet @LOCATION1 people. You can meet @LOCATION1 people be search them up if you are trying to find a old friend. Or there is social networking such as myspace, facebooks, twitter etc which you can meet @LOCATION1 people. Mostly everyone would like to meet @LOCATION1 people. To end this story my @NUM2 reason was yo can find stuff online, my second reason was you can have fun. My last reason was you can meet @LOCATION1 people."	3	4		7																					
316	1	"To whom it @MONTH1 concern, Computers are beneficial to society. They promote learning, coordination, and even general welfare. It is true that computers @MONTH1 be detrimental to a person's health, affecting the amount of exercise and interaction a person gets, but the positive effects of computers more than make up for this. People learn much of what they know from the computer. Among an infinite number of things a person can learn from them are definitions new words, scientific theories, algebraic equations, history, law, any number of languages, and much more. Computers, when used for learning, can teach people things they @MONTH1 learn in school, but on their own time, computers exercise the brain, and teach it to think beyond the bounddries of ""@NUM1."" They also teach the brain how to better direct the body to face i'ts needs. Coordination can be very hand for some people, and this can be a problem. Without coordination, people wouldn't be able to catch a ball, avoid certain dangers, or even stand. To help improve this people need practice. They can get this practice from exercise catching ball, threading a needle, or using a computer. Using the mouse on a computer can help with hand-eye coordination in that it forces the brain to direct the mouse to a certain place on the screen, in order to accomplish what is needed to be done. At first, this process @MONTH1 be excrutiatingly slow, but over time, as the brain gets practice at this coordination improves and the process speeds up @CAPS1, the person will be able to use the computer faster and more efficiently. This will help them play games, learn, or even help people when they are in need. Helping people is very important in this day an age. That's why it is important for people to find out news quickly so that they can help. Computers allow this. For example, on the day of the deadly earthquake in @LOCATION1, most of the world found out within the hour from computers. News sites broadcast its social networking sites such as @CAPS2 talked about it, and people talked to each other online about it. This rapid spread of the news saved many lives in @LOCATION1 as people immediately dropped what they were doing and rushed to help. Computers affect people in that they help to send out news and stories causing them to want to help people. Many websites also are adept at donating money while playing a game. For example, www.freenke.org is a site that donates @NUM2 grains of rice for every question answered correctly, and they have donated over @NUM3 @CAPS3 grains of rice. Obviously, computers and sites like these have to have a positive effect on the world. Overall, one would think that computers have a mostly positive effect on the world. Despite limiting exercise, they encourage learning, and the exercise of the brain. Computers also help people with their coordination, which is very important. Finally, computers promote a world where people want to help each other, and a world where people keep up with current events, whether they like it or not. Thank you, editor, for considering my side on the positive effects computers have on the world."	4	5		9																					
317	1	"Dear @CAPS1, @CAPS2 do people benefit from the use of computers. Some say that using computers rather than exercising and being outside is a bad thing. I personally believe that the use of computer technology is a good thing. Computers teach hand-eye cordination, help people learn, and allow people to communicate with others. The use of computers teach hand-eye cordination and reaction time. Some say that being outside and exercising is better than using a computer but many computer games help hand-eye cordination. Alter playing computer games more and more the time it takes for you to react to the game you are playing and hit the mouse button is very important. These skills could help you in the activities you take part in and every - day life, personally, I play a lot of @CAPS3 @NUM1, a computer gaming system. @CAPS3 has helped ny hand-eye cordination greatly and it has shown in the four sports that I play. Clearly, Computers can be very helpful and can help your hand - eye cordination. Computers can also help people learn in many ways. There is a lot of content on the internet that simply can't be in school. The ability to learn about foreign countries is a big part in learning as a student. I use the internet nearily every night to type my papers and find the information that I need. It has helped one as a student. Also, typing papers on computers is becoming the new @CAPS4 of hand writting. Teachers are beginning to require that school work is typed on a computer and printed. Documents can be saved do that they cannot be lost inlike a hard copy written by hand. Although many believe that using a computer is a waste of time, it can also help you stay organized. Many people have calenders in their computers that send you reminders on your schedule. Your computer is also where your data like music and pictures can be saved. Computers are also very useful for learning and organizational purposes. We can communicate with others using computers. People use computer technology to communicate everyday through @CAPS5, @CAPS6, and I-chat. If I need to know what our homework is or when practic is I use my computer to ask someone for the answer. Before I began communicating with my computer talking to others was much harder to do. Although many disagree with using computer technology, computers are often the way we communicate with foreign countries. When something happens overseas the first way we found out about it is a computer. It is essential for us to use computers to communicate with other nations. Clearly computers are importan for communication purposes, we must continue to use computers for multiple reasons. Although many disagree with the use of computers, there hand - eye, communications, and learning purposes are very important. Without computer technology we would function much differently. It is up to you to continue using computers. "	5	5		10																					
323	1	"Dear @CAPS1, I feel as though computers have good effects on people. Throughout these next paragraphs I will be giving you all of my reasons on the things that computers help people do. I will be talking about how computers give people good typing skills, how they give information to people, and how they allow us to socialize. Over ninety four percent of people today own a computer ad feel as though they have learned many things from it. I bet you didn't know that! First off I will be telling you about how computers help people type. The @CAPS2 on a computer doesn't go alphabetically. This means that you have to practice more to get better in typing. I remember the first time I tried to use the @CAPS2 it difficult but as I tried more I got better. Once I got better I realize where the keys were and soon I don't even have to look up the computer and all of it's parts help people by teaching them skills that they @MONTH1 used in the. These skills @MONTH1 be needed in their job field. Computers are helpful device. The next thing I will be telling you about is how computers have information that is useful to and its where a child is working know a lot about the. It holds information and has website when the internet they. The computer. My final reason why computers have good effect. If you need to talk to a friend but dont feel like calling them you can just go on to a website and chat with them. There are so many that you just can't choose! Did you know what they are over one million of these kinds of websites? There is @CAPS3 @CAPS4 just to name a few. This also gives people the chance to socialize with people from all over the world. This in return causes people to have better social skills. Maybe they will become ore friendly and become more outgoing. This is all because of one little thing and that little things is the computer! So as you can see computers have many wonderful effects on people. They help people get better at typing give lots of information that people want to know and get better social skill cant you just learning and I dont know about not I can get a pretty clear image of that in my mind. Thanks for reading this and taking I say information."	5	5		10																					
325	1	"Dear @CAPS1, In many ways computers are helpful but, I don't support the use of them. The advance in technology has really taken away from peoples lives all over the world, some examples of this are lack of exercise, too much time inside, and not enough time spent with family and friends. Continue reading for more on as towny computers do'nt benefit society. As you know, when you use a computer you usually sit in a chair to do so, correct? Well, this activity is doing only one thing, not keeping you healthy or inshape. I'm sure that you want to be healthy, and to be healthy you must get some sort of exercise through out your day, and sitting on thje computer is not helping you one bit. So as you can clearly see, so far using computers is not beneficial to our society, continue for more cons of using computers as much as they are used. Believe it or not, using a computers is unhealthy, and not beneficial, in more than one way. The reason for this is because, not only oo you not get enough exercise, you won't go outside as much. you @MONTH1 be wondering as to why not outside is unhealthy, but it is because you dont recieve the needed amount of fresh air that you need to not be sick. Could you imagine the amount of people that would be sick if everyone used the computer for the majority at their day? Well, lets just it wouldn't be fun to count them all. Now that you know two ways that computers are not beneficial to society.Keep reading for one rest way. As you probably knows, it is a hard task to keep a big family close to each other, and using computers is'nt going to anything to help you. So, why use them? Trust me, spending quality time with your family and friends can be just as much, or even more fun than playing your favorite computer games, and in my opinion your family should be the most valuable thing in your life, so don't lose them for a computer. Now that you have finished reading. i would like to thank you for your time reading this letter concerning, lack of exercise, too much time inside, and not enough time with family, is not beneficial to society."	5	4		9																					
327	1	"Dear @CAPS1, Computers can have a positive effect or a negative effect on people. It all depends on how you look at it and what type of person you are. You can say computers have a very positive effect on people or say computers have a very negative effect on people. My opinion is that computers have a positive effect on people but you can't say that I am just a kid and she plays on it all the time. Well that is true however, it can teach you hand-eye coordination. For @CAPS2 what I am doing right now is learning to type faster and faster. Another @CAPS2 is some people are faster at typing than writing but some people write faster than type. Me personally am faster at than writing. My final reason is after a hard day at school or work you can come home, play some music and relax. It is a good idea to learn how to type fast so if you are let's say writing a story for school. You just started the story and it is due tomorrow. What are you going to do well if you stared to type when you were younger by the time you are in the middle school you could type really fast. That way you could finish your story in time. This means you should learn haw to type faster. Some people prefer to write than type but other people prefer to type than write. I personally prefer to type than write but that is just me. Let's say a friend of mine like to write more than type that is ok. We will not be not friends after that we will just like the same thing that is all. This means some people prefer to write than type. This probably happens after a hard day at school or work you can come home use the computer to play some music and relax. You can play all the music you want. As well as do other things as well as the same time. For @CAPS2, I play music and talk to my friends at the same time. I @CAPS3 use it to do homework. In conclusion, it is a good idea to keep computers to use. People can still enjoy nature as well as computers at the same time. Over all computers have a positive effect on people."	3	3		6																					
337	1	"Dear Local newspaper, @CAPS1 well @CAPS1 many others, i believe computers are not only good, but beneficial. Computers are advanced our world little by little every day. We all use them for communication, entertainment, and knowledge. Computers are like people with fun to do and things to learn. Computers are beneficial to everyone worldwide. Computers gradually advance communication more and more everyday. It used to be old letters by mail, then it became e-mails, twitter, and facebook. These websites upgrage communication today. Long distance friends can view photos, information, videos, and chat from far away. Some site like @ORGANIZATION2 allow you to instant message your friends. Lastly, video chatting is a new improved way to see a live video of the other person. According to @ORGANIZATION1 @NUM1 more user signed up for web-cams since the beggining of @DATE1. Communication is positively affected by computers. I know you @MONTH1 have fun with sports or nature, but sometimes it is great to get great entertainment for yourself instantly. Computer games only cost about @MONEY1 and are instant access. Also, surfing the web for news or funny videos is fun sometimes. Almost everyone who has a @CAPS2 gets a blast surfing the internet. Do you ever wonder how to hear the song you like when it's not on the radio? Itunes stores, organize, and plays music in a virtual library for permanent access. What also happens is youtube allows you to watch music videos or hear songs for free. Now thats why computers are straight entertainment. Finally, computers provide you with so much knowledge and is great for education. Certain websites let you access tons of knowledge. Wikipedia and diccionary.com are great for learning."	5	5		10																					
353	1	To the computers people technology is a good thing to have. If we do not have technology then we can not call no one. We wiil not have computers to go online. We can not talk to my family or friends. People us technology for they jobs like people that work for cars they need computers to see if the cars if old. That is why will need technology. People need technology for a lot of thin have technology to us. Computers is the big thing because we need to look up a lot of things online we need computers to test on. We call people with technology you us computers to go online on google.com that is why we need technology. so we can call people.	3	2		5																					
356	1	"Dear Newspaper, @CAPS1, I am on the computer alot. But I think it is one of the most addicting, time consuming inventions in todays society. Yes, computers have benefits such as talking to friends and family you don't see that often, doing school work, and gathering information. But in my oponion I the people should reduce their usage of computers. Sure, computers let you interact with friends in family via e-mail, or @CAPS2 messaging, or social networking websites such as @CAPS3 or @CAPS4. Guess what? You can easily communicate the old fashioned way with cell phones, or even writing a letter. See? There are alternitives for communication. Exercise is so important now a days, and people do not get enough of it. Did you know that obesity, has gone up @PERCENT1 since last year? Thats a fairly big percentage, and we don't want it to get any bigger. If people are wasting away, staring at their computer screen and not getting any sort or exercise in, the number will get bigger. Also, computers can cause all kinds of medical problems. For example, about a month ago my back was really bothering me. I went to the doctors and he told me one of the likley causes was leaning foward togo on my laptop. ""Computers can also cause vision problems and haedaches."" says specialist @CAPS5. Oz. We can prevent these issues if we take a stand against computers! We can limit our use to two or three times a week, and only use it for important reasons. I hope this really is an eye-opener to the negative effects computers have on us."	4	4		8																					
362	1	"Newspaper, I feel that the use of computers is no big deal. it is a convienient way to communicate, it teaches young adults and adults social and life skills, and is no different than other addictions. These three reasons are why I feel the @ORGANIZATION1 is under-appreciated. My firsty reason why I feel that the @ORGANIZATION1 is under-appreciated is that some people think that less time is spend with family, but I talk to family, and friends everytime on the @ORGANIZATION1. It is a conveinient, fast, and for the most part safe way of communicating. When I need help with something, I sit at the @ORGANIZATION1 and fb chat someone, or if their not on, I e-mail them. I get my answer within a day. Also you can look up the answer online, the internet is a beautifully smart device. Also if you call someone versus chating on the @ORGANIZATION1 you @MONTH1 have no idea who they are, it is also much easier to trace a call then trace a @ORGANIZATION1 to a certain location. Communication is faster, safer, and more conveinient over the @ORGANIZATION1. My second reason for being @NUM1 is that it can help teach said and life skills. For example, did you know that on average, an adult will make @MONEY1 more if they know how to type good, and fast? The @ORGANIZATION1 serves many functions. Facebook, for example, is a social network, amny young adults can learn basic social skills by having a facebook. Social skills play a very important role when you are finding a job for the first time. If you have good social skills, your boss @MONTH1 like, and apreciate you more. Which can only lead to a promotion! Computers are very nifly to have around! my third, and final reason, for believing, with all respect, that @NUM2 people are blinded, is that people don't easily get addicted to the @ORGANIZATION1. It is very hard to become addicted to the @ORGANIZATION1. Only about @PERCENT3 of facebook users are addicted. Compared to an alcohol addiction, about @PERCENT1, or drug addiction, @PERCENT2, @ORGANIZATION1 addiction is microscopic, and not to mention, not deadly. The only similarity between the @ORGANIZATION1, and other deadlier addictions is that they are addicted, and @MONTH1 become grumpy if asked to stop. ""@ORGANIZATION1 addiction can be cured with a speedy recovery, and as long as you are on for an hour or less a day, there is nothing to worry about"" says @PERSON1, at the @NUM3.) @CAPS1 there you have it, computers use is not a major problem. It is a conveinent communication device, an effective way to learn social, and life skills, and is no huge major source of addiction. @CAPS1 there is nothing to worry about. Sit back and look it up on the internet if you don't believe me."	5	5		10																					
386	1	"Dear Newspaper, I believe that computers have a positive effect on people. I believe this because we can talk to people in different countries in a quarter of a second, we can send e-mails to other people, and finally we can go to @LOCATION1, ask @CAPS1 question and get an instant reply. First, we can talk to people in different countries. Did you ever have a relative go on vacation in a foreigh country and have no way of calling them to see if everything is okay? Lets say for instance that they brought their laptops but for at their cellphones. Then, the only way we can contact them is by e-mail. Even if your just happens in you can keep in touch through email. You can even a computer so you can video chat, and not have to wait to get your reply. Next, we can send e-mails to other people. Have you ever set somebody a letter by mail and had to wait two to three days for a reply? Sometimes, your letter is even lost, and these is no way of finding out. Well with e-mail, the wait time of your reply depends on how fast the person whom you are talking to types and most people I know can type a reply in @NUM1 to @NUM2 seconds. I believe that is a from two to three cars. With e-mail those is an eghty three percent chance that your email will not be lost. If for some reason it is lost, there will be a message sent to you telling you that your message was lost and that you need to sent a new message. But most likely chances are that your message wil reach its destination. can go to @LOCATION1, ask @CAPS1 question and get an instant reply. Were you ever wondering about something and the answer was on the tip of your tongue but you just cant think of it? If so you probably would be smart to go to @LOCATION1. You can ask @CAPS1 question and get an instant reply. And I mean @CAPS1 question you can ask questions from wat the price of is in @LOCATION2, to what an is. If you wanted to you could ask math questions as well, such as what is the square root of pi, and what is @NUM3. From @LOCATION1 to myspace the internet is full of information that can have a positive effect on people. This is why I think that the has a positive effect on people, we can talk to people different countries we can send e-mails, and we can ask all sorts of questions."	5	5		10																					
389	1	"Dear newspaper, I've read your article about peoples opinion on the affects of computers. I believe that having computers are a very good thing. With them we can talk to others from far away, and fast. You can learn a lot too. It also teaches hand-eye coordination. My first reason why they are good is because you ran talk to others. Without computers it would be almost impossible to meet people from far away and talk to them so easily. They even have webcams so you can see each other. You can use @CAPS1, @CAPS2, webcams, or even a simple comment on facebook or myspace. @CAPS2 or webcams are the quichest and maybe even coolest way. Secondly you can learn Computers have so many websites that give out alot of information and resent too. It's muchn easier to get on the internet and type something in then look threw a bunch of books.The internet has dictionaries, news stations, weather, history and where you can find things. With all that you dont even need books. They even have maps and you can print out directions. My final reason is because it teaches hand-eye coordination. When you first start using computers your normally pretty young, and sometimes you don't always type the fastest. Computers have become so advanced that there are even touch-screen and wireless mases. So when you first start you normaly look down to see what your writing, later, adults want you to look at the screen when that becames easy you know that your hand-eye coordination has grown alot better then when you stated. In conclusion I think that computers are a good part of everyday life and that there not bad. They are an easy communication between people, help you learn, and teach good and fast hand-eye coordination in kids."	4	4		8																					
