915	1	"Do computers really benifit society? This has been a tricky question for years. Some people say computers are a huge help and it allows us to see the world through a different perspective; we learn more from computers and this vast increase in tecknology. Though others say computers are addicting, it is the @CAPS2 unsafe and unsecure machine to be using especially when it is left a lot of personal files on it while hooked up to the internet. Plus people spend more time on a computer than ever, missing out on thier families and friends, not being able to enjoy nature and the other simple things in life. Besides, if you want my honest opinion, computers should only be used as tools. ""The fact is many people look to computers as personal diaries or something to save files on or even something to play games on,"" says @PERSON2. ""They ignore the biggest fact that computers are only used to make life easier."" This is really what computers are made to do, help us. It could be as simple as a @CAPS1 (@ORGANIZATION1) or as complexed as a super computer but it still only serves the main purpose of making life easier. Even if you tried to upgrade a computer it would still serve the same purpose, yet people still look on it as if it were still the next big thing in entertainment. Many people might not even know it yet but computer can turn on you and really ruin your life. Ever since @PERSON1 made @ORGANIZATION2 the @CAPS2 popular disk @ORGANIZATION1 @ORGANIZATION1 around, people have been using computers alot. Its not because he created the fastest computer ever. It is because @ORGANIZATION2 is selling world wide; for buisnesses, small companies, schools, even in entertainment. A few years ago they made something called the xbox @NUM1. It revolutionized both gaming and the way people look at gaming. But whats the problem here? The problem is that because of @ORGANIZATION2 people are now more addicted to entertainment. When this happens people will start becoming dependent on a computer. Its not that @ORGANIZATION2 did anything bad but the fact that since @CAPS2 computers have internet, those people who depend on computers are going to find it hard to avoid being hacked or worse getting all their information stolen. There is this one thing about computers that remains constant. Family and friends will find it hard to talk to there loved one when they spend all there time on computers. This makes comunication hard, and like I said before its very addicting. ""@CAPS2 of the people who don't have real friends will chat with people online not knowing who they really are."" says @CAPS3 @PERSON3. Making friends online is the @CAPS2 unsafe thing to do on a computer. Over @PERCENT1 of the people online are not who they say they are and people will often break away from thier real friends just to find this new ""friend"" they've made. So remember, even though computers are"	5	5		10																					
916	1	"Dear @LOCATION2, @CAPS1's the dillemant @CAPS2 that people are supporting computer technology and others are not. I firmly believe that having computers generally has a positive effect. This is because many jobs are using them everyday and it is very efficiant for them. Also, having computers allows people to connect with other people, edit things that other technology cannot, and play fun games, @CAPS3 effect that computers have is educational websites; games, and articals. This helps many kids find a good education and adults find a comfortable and happy job. Primarily. computers have a positive effect on people because jobs are using them frequently. Jobs such as @ORGANIZATION1 and any type of police work provide sarely for people all around the united states and other parts of the world. My father always told me, ""Computers save people everyday"". Even schools use computers! They provide educational information about the students in schools, and my school, @LOCATION1 school, uses them quite often. For example, I see my teacherm. Mr, @CAPS4 his computer every single movning in homeroom. Nearly @PERCENT1 of all jobs involve a computer by storing information or any other purposed fealuired. Would you want all those people to lose ther job because of their skills and techniques towards computer technology? I know I wouldn't, @CAPS5 keep in mind computers provide a safe and healthy life for many people. In addition, computers have a positive effect on people because they can do many things that nothing else can do. This is things like staying in town with someone far away, or editing photos. Even playing a game on the computer could ne relaxing to almost anyone. @CAPS6 is an example of keeping in town with someone else. For me, @CAPS6 is a life-saver. It allowed me to talk to my brother white he was at his chaotic college. In fact, nearly @PERCENT2 of people have an account on a computer of a public website live @CAPS7, @CAPS6, or @CAPS9. Computers keep photos saved that can be edited and even just saved to be admired. I don't want my pictures and my @CAPS6 deleted because nothing else competes with the mighty computer since it me have an enjoyable time and entertains me well. Thirdly, computers have a positive effect on people because they give aduts and kids tree access to education. I remenber my old elementery school used to play many amusing math games. These were @CAPS5 my education grew greatly dae to this game. Games as these are used frecquently thoughout the world. In addition jobs have been lost from this had economy. However, jobs we hering found more and more everyday from adults trying to find a decent job online. Computer saved people from losing their house because of the money they made with the help of computers, computers are a good idea To conclude. I imploor you that computer technology has a strong positive effect on people. Computers are like a pencil to a student. for they are very important. Jobs use them everyday, connections are made by people, and education grows because of them. That's why the technology or computers effects people in a good way."	6	5		11																					
921	1	"I believe that computers benefit society and help people understand things more clearly. Computers help people study, learn, and even talk to other people. Here are some good reasons on why computers help people out with problems. First of all, computers give you information on things that you cannot find in books. People can look up places for vacations, what their child's grade in school is, and find healthy food recipies. Without the computers people would be lost not knowing what to do. Next, computers let you talk to friends. You can discuss things like weather, ideas you have, you can even plan exercise days. What if something important happens? The person does not have his or hers phone. What could they do? They could go on the computer and tell their friend. It would be a lot easier than driving over to the persons house then driving driving all the way back. Finally, computers can give you a good sense of hand eye cordination. Computers can teach you how to type without even looking at the keyboard. This skill could be used to pursue a good career in the carpentry field. Computers can also help you study for a new job and what the requirements are. In conclusion, I believe that computers make peoples a little bit easier knowing that they have vital information right at the tips of their fingers. It can also help them in anything they want to do. Like talk to friends, look up info and teach skills."	4	4		8																					
922	1	"To whom it @MONTH1 concern, @CAPS1 more people are getting involved with using the computer while I think that is great other don't. I believe that using a computer is a good thing because technology is going to progress and computers will be the base, also computers are safer now because or privacy options and virus block. Finally, computers help you gather knowledge that no one book could tell you. Although technology is progressing computers are only the basics. Sooner or later everything will be based on computers like, jobs, school, and ever the medical field. Jobs will have more computers and touch screen devises because they are easier and more technologicly advanced. As for school @CAPS1 students have to take computer classes to learn how to write brouchures and make websites. The medical field is now using more advanced ultrasounds that take the image and make it there dementional. So, if everything is changing around you why do you want to be stick in the past? Although, some people are worried about internet saftey and viruses, there are ways that those can be limited. As for social networking sites don't set it up for the whole world to see. Set it up for only your friends to see. Also, make sure you know who your friends are. As for viruses, don't go on websites that cause viruses. Also, you can get a virus blocker that helps eliminate them. The computer also helps to give you and get you knowledge. You can learn about cocrent civilizations. Or modern day without taking a step out of your house. Also the internet has vertual simulations so you can experence what it was like in other coultures, in other time pericals. Computers give you knowledge that help you through your life especially if you don't have a library. Even though some people disagree computers are the base of technology, safe, and full of knowledge I do. Yes, they do have some flaws but they are a great learning tool."	4	4		8																					
924	1	"Dear Newspaper, Some people are asking others about the effects computers have on other people. Some experts are concerned that people are spending too much time on their computer and less time exercising, enjoying nature, and interacting with family and friends. But my opinion is that the comuter is great and it does not keep people away from other activitys. First, the computer does not keep people away from other activitys because, there are @NUM1 hours in a day, and it's that persons folt if they don't get off the computer, and go do other activitys. Even though the computer has lots of things, and it is very interesting. people. Should still have the common since to get off nad go do other things, so I think it's there fult if they don't get off the computer. Also there are a lot of reasns that people don't get out and do other activitys, so why just stop computers. Secondly, the computer does not keep people away from other activitys, because there are lots of destration that keep people away from other activitys, so why blame computers. For example the television keeps people from doing other activitys, but their not talking about stop that. Also the computer teaches you about a lot of thngs, an can so you a lot of things that you don't know about and is trying to find out. For example your family's history, you could go look that up on the computer. Lastly, the computer does not keep people away from other activitys, because if people were really worried about there other activitys then they would get off the computer and go do what they had to do. For example if they had to go to the gym then they should get off the computer, and go to the gym because the computer does not make you fat, you make yourself fat, so the should be resonable enough to go to the gym, and not be on the computer all day. Also if you were going to spend time with your family the how could the computer stop you from doing that, you should already know what you need to do and I don't think the computer would make you forget things like that. So it would be the person's fult if they forget not the computers. To rap this up, computers does not keep people away from other activitys, because it's there responablity to remeber what they need to do not the computers and there are lots more destrations then computers, but it's still not computer's falty it your's."	4	4		8																					
925	1	"To whom it @MONTH1 concern, I was sitting at home when I have realized this has to come to an end! The computer bissness has taken my mother and my stepfather away from me, I mean when they are on facebook they are in a whole nother galaxcey. The family spends no time together what so ever. Also, they argue, dont sleep and again, we don't spend anytime together! Not spending time with family isn't a good thing. Social activity is good for everyone. Even if the time spending is not with family, socializum is a very important rollplay in use. On the other hand arguing isn't. Arguing just decreases the social time spent. Arguing in my family causes friction to the point where we become unsocial and turn to a computer. Now if were arguing about the computer then we have a huge problem. The arguing will never end! Not sleeping is my biggest concern though, when they are up all nite on that stupid thing, oh gosh don't get me started. I believe they don't have good days during the day when in school. Actually I know they don't because they are day. Computers cause my parents to use up family time, fight, and not sleep, they spend more time on the personal computer than I'm a! @CITY1 @PERSON1, I think we have a problem. A very big one!"	4	3		7																					
930	1	"Dear @CAPS1, I think computers have a positive effect on people because it will help you with interacting, learning and coordination. By interacting with people like far away friends or unknown frieds. If they are far its a nice way to send photos back and forth to see how the person/people are doing. Family is a very important factor in computers because if you havent seen the person you can tell how they are progressing in life. If thats not the case you can meet new people. By meeting new people you have more connections in your life and more people to trust. Learning! Learning is a good thing for adults an children. Computers can teach children by showing them new words, colors shapes and sizes. For an adult it can show them meanings of words or new words. Words, colors and sizes can all be round on a computer all by learning. A computer can not only do mental things to affect you also physical like coordination. You can improve your coordination by making you stronger when you type. Your hands are a big thing in like and they are helpful in a lot of ways. By sitting up straight in your computer chair all day can improve your posture. Your back can get straigher from all time you are sitting. Your mind can be foucused and in one pot fucusing on thing is good for you such as the computer screen. Now, people can think that computers are good for you too. But there could be negative ideas for people who think the opposite way."	4	4		8																					
932	1	"Dear @CAPS1, @CAPS2 and kids of any age at this society, are way to focused on the latest technology. One piece of equptment that is affecting peoples lives, is the computer. We need to get rid of this habbit and learn to do different activites! People are spending way to much time on computers and less time enjoying nature excersing, and need to interact with friends and family more take the time to agree with me as I confront you on how the computer is taking over our lives! Is time flying you by? Are you overwhelmed, at how life passes you so quickley? Well, if you answered yes, stop the computer madness and head on outside! Your no enjoying nature! Nature is as beautiful as a gorgeous scene of @CAPS3 @CAPS4 love oceans with pink sand. Who would want to miss this? @PERCENT1 of @CAPS2 complain that they rarely enjoy what life has to take on the outside of your house. Just think you won't be able to see the stupendous, the seasons changing, withought going outdoors. ""I want my @CAPS6, to experience the wide variety of nature as she grows old."" @CAPS5 of her daughter. Well, @MONTH1 I add, little @CAPS6 is not going to get much nature out of her, if she does not get her eyes unglued to the comuter screen! Yes, comuters, are very brilliant, and have lots to do, but if you want to be missing out on the new trees being discovered every day, be my guest! @PERCENT2 of all the population in the @LOCATION2 is overweight due to technology brought into our world. The greatest impart is the computer! high-paid physicians try and teach their parents at a young age, to go out and play sports - while excersing at the same time and nor to stay home and play videogames. Now you tell me, would you rather get a good healthy excersise, and have all the energy you need or would you like to slowy add on to your and gain issues as you the internet? I remember @DATE1, I grabred my nike hightops, and my pink ipod I started jogging at a slow while listening to my favorite song. Naturally by I felt amazing when my was complete going each day is as healthy as eating a bannana, @NUM1 apples, and cheese eery morning their healthy! ""@CAPS7 since technology has been a part of my life, my two daughters have not visited their grand parents in over @NUM1 years! This needs to step!"" @CAPS8 @PERSON1 to the press. Yes, comuters have ""online-talking"" devices such as @CAPS9, but if you are never going to spend quality time with family, this is a bad habbit. On @DATE3, @DATE2, my brother and I, were too busy on the computer, we missed a birthday party the family we are addicted to this device, and need to spend time with our loved ones. @PERCENT3 of all therapy computers have @CAPS2 into depresion and have been with their plains, due to the high amount of to do on this device and less time bonding with members of your Who would rather play on a old, gray, computer when you can have fun talking about you day and the game life with your family? @CAPS10's now a never! What will you choose? Do you agree that computers take over lives? If you try and prove me wrong just remember, nature is a big and many people are missing out on the advantage technology is taking over peoples excersing habbits, and many families are less bonding @CAPS10's up to you keep the population of @LOCATION1 in good hands!"	6	6		12																					
934	1	"Dear @CAPS1, I strongly believe computers have positive effects on people and the society. My reasons are you can learn and find new information on anything, you are able to talk to people faraway and computers teach skills to use in the future. I will now like to elaborate my reasons further. First of all, going on the internet and search sites help you learn and find information on anything you want. On the internet you can even ask questions, and they will probably be answered. You my even use information on the computer for a report statistics show @PERCENT1 of people who do reports, find their facts on the internet. Google, yahoo, and other search sites have helped children become more intrested in learning. Also, using a computer ables you to talk to other people from faraway places or friends you have not seen in a while. You can even webcam with people. I remember a few weeks ago, my best friend moved to florida, and now we webchat everyday! Talking online will even lower your telephone bills. Chatting online doesn't lost anything, where as the telephone charges for out of country calls cost . Computers will let you talk with your best buddy and save money. Last but not least, computers teach skills that can be applied later in life. Today many jobs in due using a computer, and technology is getting mom advanced. Before you know it will have to know how to work a computer. Also, you probably will need a computer in college. Proffesor @CAPS2 even stated, ""every single kid in my courses have some sort of computer."" In college you will take notes and do assignments. Using computers will help you do this and make your life easier. As you can see i believe computers help people and society greatly. My reasons are you can learn and find information on anything, you are able to talk to other people who are faraway, and computer skills will help you in life. Technology is advancing and were going to have to use a computer sooner or later."	4	4		8																					
938	1	"Dear @CAPS1 @CAPS2, I am a child of the tech generation, or the generation in which technology has taken on a new meaning. That meaning is life. Our life revolves around technology in general as the @LOCATION3 revolves around the sun. The chief technological preference, computers, is greatly beneficial, arenâ€™t as bad as many people speculate, and help us live and prosper in this struggling world. Look, if you want to roast computers then by all means, roast away. But if you do so without first regarding all the angles of them, then you, my friend, have absolutely no standing on the situation. You could say that they are a neucence but could never have used aho. You could argue that they can be used to detonate bombs, but, lets be practical, how many normal people actually wake upwake up and point out the drearyness of life and then type in a command to detonate a bomb? A serious benefit you have obviously choes t o overlook is the invaluable information it aptly places in front of you on a @NUM1 inch screen. You can read book reviews, read books, bag things, and get the cutting-edge news you want, to name just a meager amount of possible strengths. Further more, not everything that you speculate as bad has to be bad just because you say it so. When you think of @CAPS3. Do you always think about vulgar, inappropriate pictures, and illegal images? Thatâ€™s funny, because @CAPS3 keeps family in touch, gives people things to do, and keeps friends in different states on the same server. Youtube is not all swearing and bad videos. My family casts actors for shows, and one way they know what an actor is capable of is by going to their channel and looking at the videos that they have created. My mother actually contacts actors in videos to see if they want to become professionals. That is the business, finding talent where it is seldom found. Lastly, did you even think about the fact that computers are used to start companys and saves lives? You probably didnâ€™t even know that, from a computer, astrologists monitor images of the universe captured by the hubble space carrier meteorologists track cloud formations from satellites using a computer. Maybe you didnâ€™t choose to say that surgeons can dictate operations from their office in @LOCATION1 on a patient in @LOCATION2? You didnâ€™t even say that seismologist use computers to traet the shifting of the tectonic plates to see where the epicenter of a major earthquake is? You just didnâ€™t know. So, letâ€™s face it, computers are important. You probably used to do what little research you did them. In fact, pardon me. You probably didnâ€™t do the research in the first place, instead pointing fingers at the innocent. Smooth move, buddy."	6	5		11																					
945	1	"Dear Newspaper, In my opinon I think computers do have a positive affect on people. They can learn about far away places. They let people talk online. It can even help you find a job. This is why I think computers are very positive. Certainly, people can learn about far away places on the computer. Say, someone wanted to take a trip to @LOCATION1 they can look it up, learn the launage. They can by tickets. They could also find interesting things to see in that country. These reasons are why I think a computer is a positive technology. My next reason I think a computer is positive toward people is that people can comuicate online. This can help keep families in touch. It can help you find and talk to old friends (facebook). You can even make new friends to talk to. These are other examples why I think computers are positive. My last reason I think computer have a positive affect on people is that it can help you with jobs. It can help you find a job. It can also help you with your job. Lastly, it can have you have a higher position at your job. These are my reasons I think computers are important and positive to people. For all the reasons above are reasons I think computers are an awesome =) and positive technology, I mean just look at all the reasons. They let people talk online. They can also teach you about far away places. And even help you with your job. This is why I think computers have a positive affect on people."	4	4		8																					
